{
	"schema_version": "1.0.0",
	"contract_version": "1.0.0",
	"run_id": "019e272f-3eef-7107-9712-ce281de55707-1778773912057",
	"plan_id": "plan-unknown",
	"agent_id": "019e272f-3eef-7107-9712-ce281de55707",
	"phase": "plan",
	"model": "auto",
	"thinking_level": "off",
	"tool_spans": [],
	"artifact_refs": [],
	"cost": {
		"input_tokens": 31337,
		"output_tokens": 528,
		"total_tokens": 31865
	}
}
